<?xml version="1.0" encoding="UTF-8"?>
<!-- Edited with XRT Chief Observer Tool version 2.0x40 (2080) -->
<!DOCTYPE PROG SYSTEM "XRTPRG.dtd">
<PROG>
  <modified author="TESTA, Paola" dateTime="2011-03-09T19:53:32Z" />
  <name>AR Standard-A(Filter-Ratio) with PFB (384x384), thin-Be and Al/Poly context, 512x512 at 1064 1048, 120s cad</name>
  <COT_info deleted="FALSE" lastUsed="2011-03-12T02:34:09Z" version="1867" locked="FALSE"
    tag="A7465B7E71BF/1867" COTversion="2.0x40" COTbuild="2080" Mutable="TRUE" />
  <COT_slot>-1</COT_slot>
  <COT_reserved>0</COT_reserved>
  <MAIN_RPT>0</MAIN_RPT>
  <MAIN>
    <MAIN_ENTRY POS="1">
      <Call>1</Call>
      <COT_SUBR>Subr-A</COT_SUBR>
      <Repeat>1</Repeat>
      <Interval>4</Interval>
    </MAIN_ENTRY>
    <MAIN_ENTRY POS="2">
      <Call>2</Call>
      <COT_SUBR>Subr-B</COT_SUBR>
      <Repeat>1</Repeat>
      <Interval>4</Interval>
    </MAIN_ENTRY>
  </MAIN>
  <SUBR NO="1">
  <COT_SUBR>Subr-A</COT_SUBR>
    <SUBR_ENTRY POS="1">
      <Call>17</Call>
      <COT_SEQ>73B3707353D2/2A9B</COT_SEQ>
      <Repeat>1</Repeat>
      <Interval>4</Interval>
    </SUBR_ENTRY>
    <SUBR_ENTRY POS="2">
      <Call>97</Call>
      <COT_SEQ>CC5A5EFD5C22/2B21</COT_SEQ>
      <Repeat>4</Repeat>
      <Interval>4</Interval>
    </SUBR_ENTRY>
  </SUBR>
  <SUBR NO="2">
  <COT_SUBR>Subr-B</COT_SUBR>
    <SUBR_ENTRY POS="1">
      <Call>30</Call>
      <COT_SEQ>CE950930BB6C/2B19</COT_SEQ>
      <Repeat>15</Repeat>
      <Interval>4</Interval>
    </SUBR_ENTRY>
  </SUBR>
  <SUBR NO="3">
  <COT_SUBR>Subr-C</COT_SUBR>
  </SUBR>
  <SUBR NO="4">
  <COT_SUBR>Subr-D</COT_SUBR>
  </SUBR>
</PROG>
