<?xml version="1.0" encoding="UTF-8"?>
<!-- Edited with XRT Chief Observer Tool version 0.9x14 (1312) -->
<!DOCTYPE PROG SYSTEM "XRTPRG.dtd">
<PROG>
  <modified author="SHIN, Junho" dateTime="2007-09-18T23:46:52Z" />
  <name>Program 4</name>
  <COT_info deleted="FALSE" lastUsed="2007-09-18T23:46:52Z" version="140E" locked="FALSE"
    tag="A6952AC1AD03/140E" COTversion="0.9x14" COTbuild="1312" Mutable="TRUE" />
  <COT_slot>-1</COT_slot>
  <COT_reserved>0</COT_reserved>
  <MAIN_RPT>1</MAIN_RPT>
  <MAIN>
    <MAIN_ENTRY POS="1">
      <Call>1</Call>
      <COT_SUBR>Subr-1</COT_SUBR>
      <Repeat>1</Repeat>
      <Interval>1</Interval>
    </MAIN_ENTRY>
    <MAIN_ENTRY POS="2">
      <Call>2</Call>
      <COT_SUBR>Subr-2</COT_SUBR>
      <Repeat>1</Repeat>
      <Interval>1</Interval>
    </MAIN_ENTRY>
  </MAIN>
  <SUBR NO="1">
  <COT_SUBR>Subr-1</COT_SUBR>
    <SUBR_ENTRY POS="1">
      <Call>10034</Call>
      <COT_SEQ>00002DCFF5AE/23DD</COT_SEQ>
      <Repeat>1</Repeat>
      <Interval>4</Interval>
    </SUBR_ENTRY>
  </SUBR>
  <SUBR NO="2">
  <COT_SUBR>Subr-2</COT_SUBR>
  </SUBR>
  <SUBR NO="3">
  </SUBR>
  <SUBR NO="4">
  </SUBR>
</PROG>
