<?xml version="1.0" encoding="UTF-8"?>
<!-- Edited with XRT Chief Observer Tool version 2.0x40 (2080) -->
<!DOCTYPE PROG SYSTEM "XRTPRG.dtd">
<PROG>
  <modified author="JIBBEN, Patricia" dateTime="2017-09-19T01:25:54Z" />
  <name>CCD Monitor During Bakeout - G-Band 1ms - 1kx1k - Q90 - 4th Quadrant - Al/mesh (2048ms), Al/Poly (4096ms) - w leak image-1 ms</name>
  <COT_info deleted="FALSE" lastUsed="2022-10-18T02:17:10Z" version="1BCA" locked="FALSE"
    tag="5FD86F0D15A1/1BCA" COTversion="2.0x40" COTbuild="2080" Mutable="TRUE" />
  <COT_slot>-1</COT_slot>
  <COT_reserved>0</COT_reserved>
  <MAIN_RPT>1</MAIN_RPT>
  <MAIN>
    <MAIN_ENTRY POS="1">
      <Call>1</Call>
      <COT_SUBR>Subr-A</COT_SUBR>
      <Repeat>1</Repeat>
      <Interval>4</Interval>
    </MAIN_ENTRY>
    <MAIN_ENTRY POS="2">
      <Call>2</Call>
      <COT_SUBR>Subr-B</COT_SUBR>
      <Repeat>1</Repeat>
      <Interval>4</Interval>
    </MAIN_ENTRY>
    <MAIN_ENTRY POS="3">
      <Call>3</Call>
      <COT_SUBR>Subr-C</COT_SUBR>
      <Repeat>2</Repeat>
      <Interval>4</Interval>
    </MAIN_ENTRY>
  </MAIN>
  <SUBR NO="1">
  <COT_SUBR>Subr-A</COT_SUBR>
    <SUBR_ENTRY POS="1">
      <Call>14</Call>
      <COT_SEQ>488008631C70/2E38</COT_SEQ>
      <Repeat>1</Repeat>
      <Interval>4</Interval>
    </SUBR_ENTRY>
  </SUBR>
  <SUBR NO="2">
  <COT_SUBR>Subr-B</COT_SUBR>
    <SUBR_ENTRY POS="1">
      <Call>88</Call>
      <COT_SEQ>9A4F1645B2D8/2E58</COT_SEQ>
      <Repeat>2</Repeat>
      <Interval>4</Interval>
    </SUBR_ENTRY>
  </SUBR>
  <SUBR NO="3">
  <COT_SUBR>Subr-C</COT_SUBR>
    <SUBR_ENTRY POS="1">
      <Call>34</Call>
      <COT_SEQ>02512FED6ABF/2E34</COT_SEQ>
      <Repeat>1</Repeat>
      <Interval>4</Interval>
    </SUBR_ENTRY>
  </SUBR>
  <SUBR NO="4">
  <COT_SUBR>Subr-D</COT_SUBR>
  </SUBR>
</PROG>
