<?xml version="1.0" encoding="UTF-8"?>
<!-- Edited with XRT Chief Observer Tool version 2.0x40 (2080) -->
<!DOCTYPE PROG SYSTEM "XRTPRG.dtd">
<PROG>
  <modified author="SHIMOJO, Masumi" dateTime="2008-02-28T03:34:42Z" />
  <name>CH - Al/Poly - Ti/Poly - 5 filters - Gband-FOV 512x512-low cadnse</name>
  <COT_info deleted="FALSE" lastUsed="2008-01-18T06:35:47Z" version="14AC" locked="FALSE"
    tag="1EE11E694020/14AC" COTversion="2.0x40" COTbuild="2080" Mutable="TRUE" />
  <COT_slot>-1</COT_slot>
  <COT_reserved>0</COT_reserved>
  <MAIN_RPT>0</MAIN_RPT>
  <MAIN>
    <MAIN_ENTRY POS="1">
      <Call>2</Call>
      <COT_SUBR>Subr-B</COT_SUBR>
      <Repeat>1</Repeat>
      <Interval>4</Interval>
    </MAIN_ENTRY>
    <MAIN_ENTRY POS="2">
      <Call>3</Call>
      <COT_SUBR>Subr-C</COT_SUBR>
      <Repeat>24</Repeat>
      <Interval>4</Interval>
    </MAIN_ENTRY>
    <MAIN_ENTRY POS="3">
      <Call>1</Call>
      <COT_SUBR>Subr-A</COT_SUBR>
      <Repeat>1</Repeat>
      <Interval>4</Interval>
    </MAIN_ENTRY>
  </MAIN>
  <SUBR NO="1">
  <COT_SUBR>Subr-A</COT_SUBR>
    <SUBR_ENTRY POS="1">
      <Call>100</Call>
      <COT_SEQ>000057006C90/240D</COT_SEQ>
      <Repeat>1</Repeat>
      <Interval>4</Interval>
    </SUBR_ENTRY>
  </SUBR>
  <SUBR NO="2">
  <COT_SUBR>Subr-B</COT_SUBR>
    <SUBR_ENTRY POS="1">
      <Call>49</Call>
      <COT_SEQ>D7281C11F080/2665</COT_SEQ>
      <Repeat>1</Repeat>
      <Interval>4</Interval>
    </SUBR_ENTRY>
  </SUBR>
  <SUBR NO="3">
  <COT_SUBR>Subr-C</COT_SUBR>
    <SUBR_ENTRY POS="1">
      <Call>42</Call>
      <COT_SEQ>50401999F735/2660</COT_SEQ>
      <Repeat>2</Repeat>
      <Interval>4</Interval>
    </SUBR_ENTRY>
    <SUBR_ENTRY POS="2">
      <Call>50</Call>
      <COT_SEQ>DF5013805899/2661</COT_SEQ>
      <Repeat>1</Repeat>
      <Interval>360</Interval>
    </SUBR_ENTRY>
  </SUBR>
  <SUBR NO="4">
  <COT_SUBR>Subr-D</COT_SUBR>
  </SUBR>
</PROG>
