<?xml version="1.0" encoding="UTF-8"?>
<!-- Edited with XRT Chief Observer Tool version 1.0x14 (1571) -->
<!DOCTYPE PROG SYSTEM "XRTPRG.dtd">
<PROG>
  <modified author="KORRECK, Kelly" dateTime="2009-03-28T02:13:09Z" />
  <name>AR-watch-Thin-be 10 min cadence</name>
  <COT_info deleted="FALSE" lastUsed="2009-03-28T02:05:30Z" version="1672" locked="FALSE"
    tag="3F1868E0EEC1/1672" COTversion="1.0x14" COTbuild="1571" Mutable="TRUE" />
  <COT_slot>-1</COT_slot>
  <COT_reserved>0</COT_reserved>
  <MAIN_RPT>0</MAIN_RPT>
  <MAIN>
    <MAIN_ENTRY POS="1">
      <Call>1</Call>
      <COT_SUBR>Subr-1</COT_SUBR>
      <Repeat>1</Repeat>
      <Interval>4</Interval>
    </MAIN_ENTRY>
  </MAIN>
  <SUBR NO="1">
  <COT_SUBR>Subr-1</COT_SUBR>
    <SUBR_ENTRY POS="1">
      <Call>16</Call>
      <COT_SEQ>0E462CFCED8B/28BD</COT_SEQ>
      <Repeat>1</Repeat>
      <Interval>4</Interval>
    </SUBR_ENTRY>
  </SUBR>
  <SUBR NO="2">
  </SUBR>
  <SUBR NO="3">
  </SUBR>
  <SUBR NO="4">
  </SUBR>
</PROG>
