<?xml version="1.0" encoding="UTF-8"?>
<!-- Edited with XRT Chief Observer Tool version 2.0x40 (2080) -->
<!DOCTYPE PROG SYSTEM "XRTPRG.dtd">
<PROG>
  <modified author="MINOSHIMA, Takashi" dateTime="2008-07-02T09:24:34Z" />
  <name>Polar Plume - Al/Mesh, Al/Poly, C/Poly - 512x512 -3min cadence</name>
  <COT_info deleted="FALSE" lastUsed="2008-07-30T08:41:12Z" version="1577" locked="FALSE"
    tag="C5120256875C/1577" COTversion="2.0x40" COTbuild="2080" Mutable="TRUE" />
  <COT_slot>-1</COT_slot>
  <COT_reserved>0</COT_reserved>
  <MAIN_RPT>0</MAIN_RPT>
  <MAIN>
    <MAIN_ENTRY POS="1">
      <Call>1</Call>
      <COT_SUBR>Subr-A</COT_SUBR>
      <Repeat>1</Repeat>
      <Interval>360</Interval>
    </MAIN_ENTRY>
  </MAIN>
  <SUBR NO="1">
  <COT_SUBR>Subr-A</COT_SUBR>
    <SUBR_ENTRY POS="1">
      <Call>88</Call>
      <COT_SEQ>06B0718DB202/2787</COT_SEQ>
      <Repeat>1</Repeat>
      <Interval>4</Interval>
    </SUBR_ENTRY>
  </SUBR>
  <SUBR NO="2">
  <COT_SUBR>Subr-B</COT_SUBR>
  </SUBR>
  <SUBR NO="3">
  <COT_SUBR>Subr-C</COT_SUBR>
  </SUBR>
  <SUBR NO="4">
  <COT_SUBR>Subr-D</COT_SUBR>
  </SUBR>
</PROG>
