<?xml version="1.0" encoding="UTF-8"?>
<!-- Edited with XRT Chief Observer Tool version 2.0x40 (2080) -->
<!DOCTYPE PROG SYSTEM "XRTPRG.dtd">
<PROG>
  <modified author="SAKO, Nobuharu" dateTime="2011-11-23T04:29:25Z" />
  <name>Eclipse20111125_Ti-Poly_Movie_DCpnt-duration-25min</name>
  <COT_info deleted="FALSE" lastUsed="2011-11-23T04:40:07Z" version="18C5" locked="FALSE"
    tag="D1C67D680130/18C5" COTversion="2.0x40" COTbuild="2080" Mutable="TRUE" />
  <COT_slot>-1</COT_slot>
  <COT_reserved>0</COT_reserved>
  <MAIN_RPT>1</MAIN_RPT>
  <MAIN>
    <MAIN_ENTRY POS="1">
      <Call>1</Call>
      <COT_SUBR>Subr-A</COT_SUBR>
      <Repeat>1</Repeat>
      <Interval>4</Interval>
    </MAIN_ENTRY>
    <MAIN_ENTRY POS="2">
      <Call>2</Call>
      <COT_SUBR>Subr-B</COT_SUBR>
      <Repeat>1</Repeat>
      <Interval>4</Interval>
    </MAIN_ENTRY>
  </MAIN>
  <SUBR NO="1">
  <COT_SUBR>Subr-A</COT_SUBR>
    <SUBR_ENTRY POS="1">
      <Call>64</Call>
      <COT_SEQ>566161B679B4/2B4D</COT_SEQ>
      <Repeat>1</Repeat>
      <Interval>4</Interval>
    </SUBR_ENTRY>
  </SUBR>
  <SUBR NO="2">
  <COT_SUBR>Subr-B</COT_SUBR>
    <SUBR_ENTRY POS="1">
      <Call>65</Call>
      <COT_SEQ>B4CE54C127E2/2B4E</COT_SEQ>
      <Repeat>75</Repeat>
      <Interval>40</Interval>
    </SUBR_ENTRY>
  </SUBR>
  <SUBR NO="3">
  <COT_SUBR>Subr-C</COT_SUBR>
  </SUBR>
  <SUBR NO="4">
  <COT_SUBR>Subr-D</COT_SUBR>
  </SUBR>
</PROG>
