<?xml version="1.0" encoding="UTF-8"?>
<!-- Edited with XRT Chief Observer Tool version 2.0x40 (2080) -->
<!DOCTYPE PROG SYSTEM "XRTPRG.dtd">
<PROG>
  <modified author="BANDO, Takamasa" dateTime="2011-04-20T09:10:48Z" />
  <name>AR Standard-A(Filter-Ratio) with PFB, thin-Be context, 384x384 at 1064 1048, 80s cad</name>
  <COT_info deleted="FALSE" lastUsed="2011-04-20T09:12:23Z" version="1844" locked="FALSE"
    tag="A9831F4737E2/1844" COTversion="2.0x40" COTbuild="2080" Mutable="TRUE" />
  <COT_slot>-1</COT_slot>
  <COT_reserved>0</COT_reserved>
  <MAIN_RPT>0</MAIN_RPT>
  <MAIN>
    <MAIN_ENTRY POS="1">
      <Call>1</Call>
      <COT_SUBR>Subr-A</COT_SUBR>
      <Repeat>1</Repeat>
      <Interval>4</Interval>
    </MAIN_ENTRY>
    <MAIN_ENTRY POS="2">
      <Call>2</Call>
      <COT_SUBR>Subr-B</COT_SUBR>
      <Repeat>1</Repeat>
      <Interval>4</Interval>
    </MAIN_ENTRY>
  </MAIN>
  <SUBR NO="1">
  <COT_SUBR>Subr-A</COT_SUBR>
    <SUBR_ENTRY POS="1">
      <Call>19</Call>
      <COT_SEQ>C9814D3B8B68/2A9C</COT_SEQ>
      <Repeat>1</Repeat>
      <Interval>4</Interval>
    </SUBR_ENTRY>
    <SUBR_ENTRY POS="2">
      <Call>62</Call>
      <COT_SEQ>ECBE2463E6A3/2B28</COT_SEQ>
      <Repeat>4</Repeat>
      <Interval>4</Interval>
    </SUBR_ENTRY>
  </SUBR>
  <SUBR NO="2">
  <COT_SUBR>Subr-B</COT_SUBR>
    <SUBR_ENTRY POS="1">
      <Call>2</Call>
      <COT_SEQ>ED5F03093896/2AF5</COT_SEQ>
      <Repeat>20</Repeat>
      <Interval>4</Interval>
    </SUBR_ENTRY>
  </SUBR>
  <SUBR NO="3">
  <COT_SUBR>Subr-C</COT_SUBR>
  </SUBR>
  <SUBR NO="4">
  <COT_SUBR>Subr-D</COT_SUBR>
  </SUBR>
</PROG>
