<?xml version="1.0" encoding="UTF-8"?>
<!-- Edited with XRT Chief Observer Tool version 2.0x40 (2080) -->
<!DOCTYPE PROG SYSTEM "XRTPRG.dtd">
<PROG>
  <modified author="CIRTAIN, Jonathan" dateTime="2008-03-04T02:33:42Z" />
  <name>CH AL/Poly + Be/thin + GBand - 512x512 - Disk Center</name>
  <COT_info deleted="FALSE" lastUsed="2008-03-04T02:42:50Z" version="14F1" locked="FALSE"
    tag="969709B53AF8/14F1" COTversion="2.0x40" COTbuild="2080" Mutable="TRUE" />
  <COT_slot>-1</COT_slot>
  <COT_reserved>0</COT_reserved>
  <MAIN_RPT>0</MAIN_RPT>
  <MAIN>
    <MAIN_ENTRY POS="1">
      <Call>1</Call>
      <COT_SUBR>Subr-A</COT_SUBR>
      <Repeat>1</Repeat>
      <Interval>7200</Interval>
    </MAIN_ENTRY>
  </MAIN>
  <SUBR NO="1">
  <COT_SUBR>Subr-A</COT_SUBR>
    <SUBR_ENTRY POS="1">
      <Call>38</Call>
      <COT_SEQ>1D921FF55B1C/26CB</COT_SEQ>
      <Repeat>1</Repeat>
      <Interval>4</Interval>
    </SUBR_ENTRY>
    <SUBR_ENTRY POS="2">
      <Call>64</Call>
      <COT_SEQ>D96812A0DEFE/26CC</COT_SEQ>
      <Repeat>10</Repeat>
      <Interval>16</Interval>
    </SUBR_ENTRY>
  </SUBR>
  <SUBR NO="2">
  <COT_SUBR>Subr-B</COT_SUBR>
  </SUBR>
  <SUBR NO="3">
  <COT_SUBR>Subr-C</COT_SUBR>
  </SUBR>
  <SUBR NO="4">
  <COT_SUBR>Subr-D</COT_SUBR>
  </SUBR>
</PROG>
