<?xml version="1.0" encoding="UTF-8"?>
<!-- Edited with XRT Chief Observer Tool version 2.0x40 (2080) -->
<!DOCTYPE PROG SYSTEM "XRTPRG.dtd">
<PROG>
  <modified author="REEVES, Kathy" dateTime="2015-05-20T18:23:48Z" />
  <name>EVE Rocket Cal - Synoptic 6-filter + CME Watch</name>
  <COT_info deleted="FALSE" lastUsed="2015-05-21T01:56:06Z" version="1A87" locked="FALSE"
    tag="4AF519BCC82B/1A87" COTversion="2.0x40" COTbuild="2080" Mutable="TRUE" />
  <COT_slot>-1</COT_slot>
  <COT_reserved>0</COT_reserved>
  <MAIN_RPT>1</MAIN_RPT>
  <MAIN>
    <MAIN_ENTRY POS="1">
      <Call>1</Call>
      <COT_SUBR>Subr-A</COT_SUBR>
      <Repeat>1</Repeat>
      <Interval>24</Interval>
    </MAIN_ENTRY>
    <MAIN_ENTRY POS="2">
      <Call>2</Call>
      <COT_SUBR>Subr-B</COT_SUBR>
      <Repeat>2</Repeat>
      <Interval>24</Interval>
    </MAIN_ENTRY>
    <MAIN_ENTRY POS="3">
      <Call>3</Call>
      <COT_SUBR>Subr-C</COT_SUBR>
      <Repeat>86</Repeat>
      <Interval>40</Interval>
    </MAIN_ENTRY>
    <MAIN_ENTRY POS="4">
      <Call>4</Call>
      <COT_SUBR>Subr-D</COT_SUBR>
      <Repeat>1</Repeat>
      <Interval>24</Interval>
    </MAIN_ENTRY>
  </MAIN>
  <SUBR NO="1">
  <COT_SUBR>Subr-A</COT_SUBR>
    <SUBR_ENTRY POS="1">
      <Call>33</Call>
      <COT_SEQ>FF2135DBC632/2D28</COT_SEQ>
      <Repeat>1</Repeat>
      <Interval>8</Interval>
    </SUBR_ENTRY>
    <SUBR_ENTRY POS="2">
      <Call>5</Call>
      <COT_SEQ>8E2E20BB6B2A/2938</COT_SEQ>
      <Repeat>1</Repeat>
      <Interval>4</Interval>
    </SUBR_ENTRY>
    <SUBR_ENTRY POS="3">
      <Call>40</Call>
      <COT_SEQ>983F2BBE58A3/2D12</COT_SEQ>
      <Repeat>1</Repeat>
      <Interval>8</Interval>
    </SUBR_ENTRY>
    <SUBR_ENTRY POS="4">
      <Call>6</Call>
      <COT_SEQ>1C0041FB3B34/2C93</COT_SEQ>
      <Repeat>1</Repeat>
      <Interval>4</Interval>
    </SUBR_ENTRY>
  </SUBR>
  <SUBR NO="2">
  <COT_SUBR>Subr-B</COT_SUBR>
    <SUBR_ENTRY POS="1">
      <Call>46</Call>
      <COT_SEQ>205014AEA72F/2839</COT_SEQ>
      <Repeat>1</Repeat>
      <Interval>4</Interval>
    </SUBR_ENTRY>
    <SUBR_ENTRY POS="2">
      <Call>77</Call>
      <COT_SEQ>1DE90D807446/2D29</COT_SEQ>
      <Repeat>1</Repeat>
      <Interval>4</Interval>
    </SUBR_ENTRY>
    <SUBR_ENTRY POS="3">
      <Call>72</Call>
      <COT_SEQ>45611892D3C4/2A1C</COT_SEQ>
      <Repeat>1</Repeat>
      <Interval>4</Interval>
    </SUBR_ENTRY>
  </SUBR>
  <SUBR NO="3">
  <COT_SUBR>Subr-C</COT_SUBR>
    <SUBR_ENTRY POS="1">
      <Call>29</Call>
      <COT_SEQ>5C0A2EF21D0E/2C83</COT_SEQ>
      <Repeat>1</Repeat>
      <Interval>4</Interval>
    </SUBR_ENTRY>
  </SUBR>
  <SUBR NO="4">
  <COT_SUBR>Subr-D</COT_SUBR>
    <SUBR_ENTRY POS="1">
      <Call>46</Call>
      <COT_SEQ>205014AEA72F/2839</COT_SEQ>
      <Repeat>1</Repeat>
      <Interval>4</Interval>
    </SUBR_ENTRY>
    <SUBR_ENTRY POS="2">
      <Call>77</Call>
      <COT_SEQ>1DE90D807446/2D29</COT_SEQ>
      <Repeat>1</Repeat>
      <Interval>4</Interval>
    </SUBR_ENTRY>
    <SUBR_ENTRY POS="3">
      <Call>72</Call>
      <COT_SEQ>45611892D3C4/2A1C</COT_SEQ>
      <Repeat>1</Repeat>
      <Interval>4</Interval>
    </SUBR_ENTRY>
  </SUBR>
</PROG>
