<?xml version="1.0" encoding="UTF-8"?>
<!-- Edited with XRT Chief Observer Tool version 2.0x40 (2080) -->
<!DOCTYPE PROG SYSTEM "XRTPRG.dtd">
<PROG>
  <modified author="LEE, Jin-Yi" dateTime="2009-09-24T03:14:06Z" />
  <name>AR/filament - C/poly+Thin-Be - 1x1 384x384 AEC1 - 2x2 768x768 AEC2</name>
  <COT_info deleted="FALSE" lastUsed="2009-09-24T03:30:41Z" version="1711" locked="FALSE"
    tag="C95648A3D94D/1711" COTversion="2.0x40" COTbuild="2080" Mutable="TRUE" />
  <COT_slot>-1</COT_slot>
  <COT_reserved>0</COT_reserved>
  <MAIN_RPT>0</MAIN_RPT>
  <MAIN>
    <MAIN_ENTRY POS="1">
      <Call>1</Call>
      <COT_SUBR>Subr-A</COT_SUBR>
      <Repeat>10</Repeat>
      <Interval>20</Interval>
    </MAIN_ENTRY>
    <MAIN_ENTRY POS="2">
      <Call>2</Call>
      <COT_SUBR>Subr-B</COT_SUBR>
      <Repeat>1</Repeat>
      <Interval>4</Interval>
    </MAIN_ENTRY>
  </MAIN>
  <SUBR NO="1">
  <COT_SUBR>Subr-A</COT_SUBR>
    <SUBR_ENTRY POS="1">
      <Call>66</Call>
      <COT_SEQ>44A6493022ED/298E</COT_SEQ>
      <Repeat>3</Repeat>
      <Interval>240</Interval>
    </SUBR_ENTRY>
    <SUBR_ENTRY POS="2">
      <Call>74</Call>
      <COT_SEQ>168D76766FB9/298F</COT_SEQ>
      <Repeat>1</Repeat>
      <Interval>8</Interval>
    </SUBR_ENTRY>
  </SUBR>
  <SUBR NO="2">
  <COT_SUBR>Subr-B</COT_SUBR>
    <SUBR_ENTRY POS="1">
      <Call>72</Call>
      <COT_SEQ>B49611070F00/2982</COT_SEQ>
      <Repeat>1</Repeat>
      <Interval>8</Interval>
    </SUBR_ENTRY>
  </SUBR>
  <SUBR NO="3">
  <COT_SUBR>Subr-C</COT_SUBR>
  </SUBR>
  <SUBR NO="4">
  <COT_SUBR>Subr-D</COT_SUBR>
  </SUBR>
</PROG>
