<?xml version="1.0" encoding="UTF-8"?>
<!-- Edited with XRT Chief Observer Tool version 2.0x40 (2080) -->
<!DOCTYPE PROG SYSTEM "XRTPRG.dtd">
<PROG>
  <modified author="ISHIBASHI, Bish" dateTime="2011-05-04T06:46:23Z" />
  <name>Flare Standard Obs. with eruptions mode-A (FW1=Open )</name>
  <COT_info deleted="FALSE" lastUsed="2013-05-31T19:19:36Z" version="1828" locked="FALSE"
    tag="88A34E207D52/1828" COTversion="2.0x40" COTbuild="2080" Mutable="TRUE" />
  <COT_slot>-1</COT_slot>
  <COT_reserved>0</COT_reserved>
  <MAIN_RPT>1</MAIN_RPT>
  <MAIN>
    <MAIN_ENTRY POS="1">
      <Call>1</Call>
      <COT_SUBR>Subr-A</COT_SUBR>
      <Repeat>30</Repeat>
      <Interval>40</Interval>
    </MAIN_ENTRY>
    <MAIN_ENTRY POS="2">
      <Call>2</Call>
      <COT_SUBR>Subr-B</COT_SUBR>
      <Repeat>1</Repeat>
      <Interval>4</Interval>
    </MAIN_ENTRY>
    <MAIN_ENTRY POS="3">
      <Call>3</Call>
      <COT_SUBR>Subr-C</COT_SUBR>
      <Repeat>30</Repeat>
      <Interval>120</Interval>
    </MAIN_ENTRY>
    <MAIN_ENTRY POS="4">
      <Call>2</Call>
      <COT_SUBR>Subr-B</COT_SUBR>
      <Repeat>1</Repeat>
      <Interval>4</Interval>
    </MAIN_ENTRY>
    <MAIN_ENTRY POS="5">
      <Call>3</Call>
      <COT_SUBR>Subr-C</COT_SUBR>
      <Repeat>30</Repeat>
      <Interval>120</Interval>
    </MAIN_ENTRY>
    <MAIN_ENTRY POS="6">
      <Call>2</Call>
      <COT_SUBR>Subr-B</COT_SUBR>
      <Repeat>1</Repeat>
      <Interval>4</Interval>
    </MAIN_ENTRY>
    <MAIN_ENTRY POS="7">
      <Call>3</Call>
      <COT_SUBR>Subr-C</COT_SUBR>
      <Repeat>30</Repeat>
      <Interval>120</Interval>
    </MAIN_ENTRY>
    <MAIN_ENTRY POS="8">
      <Call>4</Call>
      <COT_SUBR>Subr-D</COT_SUBR>
      <Repeat>24</Repeat>
      <Interval>1200</Interval>
    </MAIN_ENTRY>
  </MAIN>
  <SUBR NO="1">
  <COT_SUBR>Subr-A</COT_SUBR>
    <SUBR_ENTRY POS="1">
      <Call>58</Call>
      <COT_SEQ>6C380D339905/2A88</COT_SEQ>
      <Repeat>1</Repeat>
      <Interval>4</Interval>
    </SUBR_ENTRY>
    <SUBR_ENTRY POS="2">
      <Call>64</Call>
      <COT_SEQ>61CF4CDD269B/2AD8</COT_SEQ>
      <Repeat>1</Repeat>
      <Interval>4</Interval>
    </SUBR_ENTRY>
  </SUBR>
  <SUBR NO="2">
  <COT_SUBR>Subr-B</COT_SUBR>
    <SUBR_ENTRY POS="1">
      <Call>59</Call>
      <COT_SEQ>8F750E7933A4/2A8B</COT_SEQ>
      <Repeat>1</Repeat>
      <Interval>4</Interval>
    </SUBR_ENTRY>
  </SUBR>
  <SUBR NO="3">
  <COT_SUBR>Subr-C</COT_SUBR>
    <SUBR_ENTRY POS="1">
      <Call>58</Call>
      <COT_SEQ>6C380D339905/2A88</COT_SEQ>
      <Repeat>1</Repeat>
      <Interval>4</Interval>
    </SUBR_ENTRY>
    <SUBR_ENTRY POS="2">
      <Call>60</Call>
      <COT_SEQ>957F3D139E75/2A8C</COT_SEQ>
      <Repeat>1</Repeat>
      <Interval>4</Interval>
    </SUBR_ENTRY>
  </SUBR>
  <SUBR NO="4">
  <COT_SUBR>Subr-D</COT_SUBR>
    <SUBR_ENTRY POS="1">
      <Call>61</Call>
      <COT_SEQ>13BF58ACEDF0/2A8D</COT_SEQ>
      <Repeat>1</Repeat>
      <Interval>4</Interval>
    </SUBR_ENTRY>
  </SUBR>
</PROG>
