<?xml version="1.0" encoding="UTF-8"?>
<!-- Edited with XRT Chief Observer Tool version 2.0x40 (2080) -->
<!DOCTYPE PROG SYSTEM "XRTPRG.dtd">
<PROG>
  <modified author="YOSHIMURA, Keiji" dateTime="2017-06-12T20:45:35Z" />
  <name>Stray light study 2017-8 ; med-Be, 2x2 full FOV(1min-cad) and 2x2 256 on AR(10sec-cad) </name>
  <COT_info deleted="FALSE" lastUsed="2017-06-15T02:11:00Z" version="1B9B" locked="FALSE"
    tag="9F9542D7F5A6/1B9B" COTversion="2.0x40" COTbuild="2080" Mutable="TRUE" />
  <COT_slot>-1</COT_slot>
  <COT_reserved>0</COT_reserved>
  <MAIN_RPT>1</MAIN_RPT>
  <MAIN>
    <MAIN_ENTRY POS="1">
      <Call>1</Call>
      <COT_SUBR>Subr-A</COT_SUBR>
      <Repeat>1</Repeat>
      <Interval>4</Interval>
    </MAIN_ENTRY>
    <MAIN_ENTRY POS="2">
      <Call>2</Call>
      <COT_SUBR>Subr-B</COT_SUBR>
      <Repeat>10</Repeat>
      <Interval>4</Interval>
    </MAIN_ENTRY>
    <MAIN_ENTRY POS="3">
      <Call>3</Call>
      <COT_SUBR>Subr-C</COT_SUBR>
      <Repeat>6</Repeat>
      <Interval>4</Interval>
    </MAIN_ENTRY>
  </MAIN>
  <SUBR NO="1">
  <COT_SUBR>Subr-A</COT_SUBR>
    <SUBR_ENTRY POS="1">
      <Call>41</Call>
      <COT_SEQ>217373BD5159/2DE4</COT_SEQ>
      <Repeat>1</Repeat>
      <Interval>300</Interval>
    </SUBR_ENTRY>
  </SUBR>
  <SUBR NO="2">
  <COT_SUBR>Subr-B</COT_SUBR>
    <SUBR_ENTRY POS="1">
      <Call>4</Call>
      <COT_SEQ>DE97041C6BB3/2D74</COT_SEQ>
      <Repeat>1</Repeat>
      <Interval>20</Interval>
    </SUBR_ENTRY>
  </SUBR>
  <SUBR NO="3">
  <COT_SUBR>Subr-C</COT_SUBR>
    <SUBR_ENTRY POS="1">
      <Call>31</Call>
      <COT_SEQ>7AE205C483F4/2CEB</COT_SEQ>
      <Repeat>1</Repeat>
      <Interval>4</Interval>
    </SUBR_ENTRY>
    <SUBR_ENTRY POS="2">
      <Call>4</Call>
      <COT_SEQ>DE97041C6BB3/2D74</COT_SEQ>
      <Repeat>3</Repeat>
      <Interval>20</Interval>
    </SUBR_ENTRY>
  </SUBR>
  <SUBR NO="4">
  <COT_SUBR>Subr-D</COT_SUBR>
  </SUBR>
</PROG>
