<?xml version="1.0" encoding="UTF-8"?>
<!-- Edited with XRT Chief Observer Tool version 1.0x14 (1571) -->
<!DOCTYPE PROG SYSTEM "XRTPRG.dtd">
<PROG>
  <modified author="BANDO, Takamasa" dateTime="2008-02-19T07:58:24Z" />
  <name>Program 2</name>
  <COT_info deleted="FALSE" lastUsed="2007-01-22T05:04:15Z" version="1302" locked="FALSE"
    tag="00003DF4297C/1302" COTversion="1.0x14" COTbuild="1571" Mutable="TRUE" />
  <COT_slot>-1</COT_slot>
  <COT_reserved>0</COT_reserved>
  <MAIN_RPT>1</MAIN_RPT>
  <MAIN>
  </MAIN>
  <SUBR NO="1">
  </SUBR>
  <SUBR NO="2">
  </SUBR>
  <SUBR NO="3">
  </SUBR>
  <SUBR NO="4">
  </SUBR>
</PROG>
