<?xml version="1.0" encoding="UTF-8"?>
<!-- Edited with XRT Chief Observer Tool version 2.0x40 (2080) -->
<!DOCTYPE PROG SYSTEM "XRTPRG.dtd">
<PROG>
  <modified author="KANO, Ryouhei" dateTime="2009-10-10T02:33:19Z" />
  <name>Synoptic Q95 2x2 - Al/poly(362/2897) + Dark cal(2x2 4x4 8x8 512 Q98) + Ti-poly(512/4096) + G-band(16)</name>
  <COT_info deleted="FALSE" lastUsed="2009-10-20T02:32:39Z" version="171B" locked="FALSE"
    tag="B9220D9D8372/171B" COTversion="2.0x40" COTbuild="2080" Mutable="TRUE" />
  <COT_slot>-1</COT_slot>
  <COT_reserved>0</COT_reserved>
  <MAIN_RPT>1</MAIN_RPT>
  <MAIN>
    <MAIN_ENTRY POS="1">
      <Call>1</Call>
      <COT_SUBR>Subr-A</COT_SUBR>
      <Repeat>1</Repeat>
      <Interval>24</Interval>
    </MAIN_ENTRY>
  </MAIN>
  <SUBR NO="1">
  <COT_SUBR>Subr-A</COT_SUBR>
    <SUBR_ENTRY POS="1">
      <Call>44</Call>
      <COT_SEQ>F09116741807/2995</COT_SEQ>
      <Repeat>1</Repeat>
      <Interval>8</Interval>
    </SUBR_ENTRY>
    <SUBR_ENTRY POS="2">
      <Call>58</Call>
      <COT_SEQ>9E686155D92D/28A3</COT_SEQ>
      <Repeat>1</Repeat>
      <Interval>4</Interval>
    </SUBR_ENTRY>
    <SUBR_ENTRY POS="3">
      <Call>35</Call>
      <COT_SEQ>58D97494F087/28AA</COT_SEQ>
      <Repeat>1</Repeat>
      <Interval>8</Interval>
    </SUBR_ENTRY>
    <SUBR_ENTRY POS="4">
      <Call>11</Call>
      <COT_SEQ>3C647339F452/27C6</COT_SEQ>
      <Repeat>1</Repeat>
      <Interval>4</Interval>
    </SUBR_ENTRY>
  </SUBR>
  <SUBR NO="2">
  <COT_SUBR>Subr-B</COT_SUBR>
  </SUBR>
  <SUBR NO="3">
  <COT_SUBR>Subr-C</COT_SUBR>
  </SUBR>
  <SUBR NO="4">
  <COT_SUBR>Subr-D</COT_SUBR>
  </SUBR>
</PROG>
